{
  "id": "rob_surgical",
  "name": "Rob Surgical",
  "country": "Spain",
  "urls": [
    {
      "caption": "Rob Surgical",
      "url": "https://www.robsurgical.com/"
    }
  ],
  "linkedin_url": "https://www.linkedin.com/company/rob-surgical/",
  "opencorporates_url": "",
  "robots": [
    "rob_surgical_bitrack"
  ],
  "description": "Rob Surgical is based in Barcelona, Spain.",
  "employee_count": "50-100",
  "patents": {
    "assignee_names": [
      "Rob Surgical"
    ],
    "google_patents_url": "https://patents.google.com/?assignee=%22Rob+Surgical%22",
    "lens_url": "https://www.lens.org/lens/search/patent/list?q=applicant%3A%22Rob%20Surgical%22&s=_score&d=%2B&p=0&n=50"
  }
}
