{
  "id": "asensus_surgical",
  "name": "Asensus Surgical",
  "country": "United States",
  "urls": [
    {
      "caption": "Asensus",
      "url": "https://www.asensus.com"
    }
  ],
  "linkedin_url": "https://www.linkedin.com/company/asensus-surgical/",
  "opencorporates_url": "https://opencorporates.com/companies/us_ca/4851984",
  "robots": [
    "asensus_senhance",
    "asensus_luna"
  ],
  "subsidiaries": [
    "TransEnterix"
  ],
  "description": "Asensus Surgical is based in Durham, North Carolina, USA.",
  "employee_count": "100-500",
  "patents": {
    "assignee_names": [
      "Asensus Surgical",
      "TransEnterix"
    ],
    "google_patents_url": "https://patents.google.com/?assignee=%22Asensus+Surgical%22",
    "lens_url": "https://www.lens.org/lens/search/patent/list?q=%28applicant%3A%22Asensus%20Surgical%22%20OR%20applicant%3A%22TransEnterix%22%29&s=_score&d=%2B&p=0&n=50"
  },
  "status": {
    "state": "acquired",
    "year": 2024,
    "successor": "KARL STORZ",
    "note": "Acquired by KARL STORZ in August 2024; standalone robotic hardware development was subsequently phased out to integrate software, AI, and IP into KARL STORZ surgical ecosystems.",
    "source_url": "https://www.karlstorz.com/us/en/asensus-surgical-announces-closing-of-acquisition-by-karl-storz.htm"
  }
}
