{
  "id": "medicaroid",
  "name": "Medicaroid",
  "country": "Japan",
  "urls": [
    {
      "caption": "Medicaroid",
      "url": "https://www.medicaroid.com"
    }
  ],
  "linkedin_url": "https://www.linkedin.com/company/medicaroid/",
  "opencorporates_url": "",
  "robots": [
    "medicaroid_hinotori"
  ],
  "description": "Medicaroid is a Japanese company based in Kobe, Japan.",
  "employee_count": "100-500",
  "patents": {
    "assignee_names": [
      "Medicaroid"
    ],
    "google_patents_url": "https://patents.google.com/?assignee=Medicaroid",
    "lens_url": "https://www.lens.org/lens/search/patent/list?q=applicant%3A%22Medicaroid%22&s=_score&d=%2B&p=0&n=50"
  }
}
