{
  "id": "revolve_surgical",
  "name": "Revolve Surgical",
  "country": "Canada",
  "urls": [
    {
      "caption": "Revolve Surgical",
      "url": "https://www.revolvesurgical.com"
    }
  ],
  "linkedin_url": "https://www.linkedin.com/company/revolve-surgical/",
  "opencorporates_url": "https://opencorporates.com/companies/ca/11465724",
  "robots": [
    "revolve_R1"
  ],
  "description": "Revolve Surgical is based in Toronto, Ontario, Canada.",
  "employee_count": "0-10",
  "patents": {
    "assignee_names": [
      "Revolve Surgical"
    ],
    "google_patents_url": "https://patents.google.com/?assignee=%22Revolve+Surgical%22",
    "lens_url": "https://www.lens.org/lens/search/patent/list?q=applicant%3A%22Revolve%20Surgical%22&s=_score&d=%2B&p=0&n=50"
  }
}
