{
  "id": "ecential_robotics",
  "name": "eCential Robotics",
  "country": "France",
  "urls": [
    {
      "caption": "eCential Robotics",
      "url": "https://www.ecential-robotics.com/en-us"
    }
  ],
  "linkedin_url": "https://www.linkedin.com/company/ecential-robotics/",
  "opencorporates_url": "https://opencorporates.com/companies/fr/518910419",
  "robots": [
    "ecential_robotics_platform"
  ],
  "description": "eCential Robotics is based in Grenoble, France.",
  "employee_count": "100-500",
  "patents": {
    "assignee_names": [
      "eCential Robotics"
    ],
    "google_patents_url": "https://patents.google.com/?assignee=%22eCential+Robotics%22",
    "lens_url": "https://www.lens.org/lens/search/patent/list?q=applicant%3A%22eCential%20Robotics%22&s=_score&d=%2B&p=0&n=50"
  }
}
