{
  "id": "ronovo_surgical",
  "name": "Ronovo Surgical",
  "country": "China",
  "urls": [
    {
      "caption": "Ronovo Surgical",
      "url": "https://www.ronovosurgical.com"
    }
  ],
  "linkedin_url": "https://www.linkedin.com/company/ronovo-surgical/",
  "opencorporates_url": "https://opencorporates.com/companies/hk/2878302",
  "robots": [
    "ronovo_carina"
  ],
  "description": "Ronovo Surgical is based in Hangzhou, China.",
  "employee_count": "100-500",
  "patents": {
    "assignee_names": [
      "Ronovo Surgical"
    ],
    "google_patents_url": "https://patents.google.com/?assignee=%22Ronovo+Surgical%22",
    "lens_url": "https://www.lens.org/lens/search/patent/list?q=applicant%3A%22Ronovo%20Surgical%22&s=_score&d=%2B&p=0&n=50"
  }
}
