{
  "id": "kuka",
  "name": "KUKA",
  "country": "Germany",
  "urls": [
    {
      "caption": "KUKA Medical Robotics",
      "url": "https://www.kuka.com/medical-robotics"
    }
  ],
  "linkedin_url": "https://www.linkedin.com/company/kukaglobal/",
  "opencorporates_url": "",
  "robots": [
    "kuka_lbr_med",
    "kuka_kr_quantec_hc"
  ],
  "description": "KUKA AG is a global automation company headquartered in Augsburg, Germany. Its LBR Med series offers medical-certified collaborative robot arms for OEM integration into medical devices and systems.",
  "employee_count": "1000+",
  "patents": {
    "assignee_names": [
      "KUKA",
      "KUKA Roboter"
    ],
    "google_patents_url": "https://patents.google.com/?assignee=KUKA",
    "lens_url": "https://www.lens.org/lens/search/patent/list?q=%28applicant%3A%22KUKA%22%20OR%20applicant%3A%22KUKA%20Roboter%22%29&s=_score&d=%2B&p=0&n=50"
  }
}
